{
  "schemaVersion": "extraction-revision.v1",
  "extractionRevisionId": "er-md-001",
  "sourceId": "contract-markdown",
  "sourceRevisionId": "sr-md-001",
  "adapter": "markdown",
  "adapterVersion": "contract-fixture-v1",
  "startedAt": "2026-05-17T01:00:02Z",
  "completedAt": "2026-05-17T01:00:03Z",
  "status": "complete_with_warnings",
  "emittedUnitIds": ["unit-md-0001", "unit-md-0002"],
  "warnings": ["unit-md-0002 is known but blocked by an unresolved include directive"]
}
